
<!ELEMENT Biblioteca (Libro,revista,periodicos)>
<!ATTLIST libro id ID #REQUIRED>
<!ATTLIST libro tipo_clase (novela|infantil|didactico) ID #REQUIRED>
<!ATTLIST libro numero_paginas CDATA >
<!ATTLIST capitulo numero_paginas CDATA >



<!ELEMENT  libro+ (titulo,capitulo,indice,sinopsis)>
<!ELEMENT titulo (#PCDATA)>
<!ELEMENT capitulo (titulo,contenido)>
<!ELEMENT contenido(EMPTY)>
<!ELEMENT indice(EMPTY)>
<!ELEMENT sinopsis (#PCDATA)>
